{
  "id": "context7",
  "version": "2.0.0",
  "trust": "official",
  "provider": {
    "name": "Context7",
    "homepage": "https://context7.com",
    "icon": "\ud83d\udcda",
    "logo": "/logos/context7.png"
  },
  "detect": [
    {
      "type": "mcp",
      "server": "context7"
    },
    {
      "type": "file",
      "path": "**/.mcp.json",
      "contains": "context7"
    }
  ],
  "objectives": [
    {
      "id": "resolve-library",
      "title": "Resolve a library to its Context7 id",
      "why": "Resolving first is what stops you fetching docs for the wrong package.",
      "badge": "librarian",
      "criteria": {
        "type": "mcp_tool",
        "server": "context7",
        "tool": "resolve-library-id"
      },
      "docs": "https://context7.com"
    },
    {
      "id": "fetch-docs",
      "title": "Fetch version-accurate docs",
      "why": "Model training data goes stale; Context7 pulls the docs for the version you actually use.",
      "badge": "scholar",
      "criteria": {
        "type": "mcp_tool",
        "server": "context7",
        "tool": "get-library-docs"
      },
      "docs": "https://context7.com"
    },
    {
      "id": "topic-scoped-lookup",
      "title": "Narrow a lookup to a topic",
      "why": "Pulling a whole library's docs burns context; a topic-scoped fetch is the difference between usable and overwhelming.",
      "badge": "focused",
      "criteria": {
        "type": "mcp_tool",
        "server": "context7",
        "tool": "get-library-docs",
        "gte": 3
      },
      "docs": "https://context7.com"
    },
    {
      "id": "cover-your-stack",
      "title": "Look up several of your dependencies",
      "why": "One library is a trial; your whole stack is a habit.",
      "badge": "polyglot",
      "criteria": {
        "type": "mcp_tool",
        "server": "context7",
        "tool": "resolve-library-id",
        "gte": 3
      },
      "docs": "https://context7.com"
    },
    {
      "id": "add-to-rules",
      "title": "Tell your agent to check docs first",
      "why": "A rule in CLAUDE.md is what makes this happen without you asking every time.",
      "badge": "documented",
      "criteria": {
        "type": "file",
        "path": "**/{CLAUDE,AGENTS}.md",
        "contains": "context7"
      },
      "docs": "https://docs.claude.com/en/docs/claude-code/memory"
    },
    {
      "id": "add-to-project",
      "title": "Check the server into the project",
      "why": "In .mcp.json it works for your teammates too, not just on your laptop.",
      "badge": "shared",
      "criteria": {
        "type": "file",
        "path": "**/.mcp.json",
        "contains": "context7"
      },
      "docs": "https://docs.claude.com/en/docs/claude-code/mcp"
    }
  ],
  "bestPractices": [
    {
      "id": "api-key-not-committed",
      "title": "Keep your Context7 API key out of git",
      "why": "A committed key is someone else's quota.",
      "badge": "keeper",
      "criteria": {
        "type": "env",
        "key": "CONTEXT7_API_KEY",
        "absent_from": "git"
      },
      "recommended": true,
      "docs": "https://context7.com"
    },
    {
      "id": "fetch-before-code",
      "title": "Fetch docs before writing against an unfamiliar API",
      "why": "Hallucinated method names are exactly what up-to-date docs prevent.",
      "badge": "informed",
      "criteria": {
        "type": "llm_judge",
        "over": {
          "file": "**/{CLAUDE,AGENTS}.md"
        },
        "rubric": "Do the project rules instruct the agent to look up current documentation before writing code against an unfamiliar library?",
        "confidence_gte": 0.8
      },
      "recommended": true,
      "docs": "https://docs.claude.com/en/docs/claude-code/memory"
    }
  ],
  "badges": [
    {
      "id": "librarian",
      "name": "Librarian",
      "tier": "bronze",
      "description": "Resolved a library id."
    },
    {
      "id": "scholar",
      "name": "Scholar",
      "tier": "bronze",
      "description": "Fetched version-accurate docs."
    },
    {
      "id": "focused",
      "name": "Focused",
      "tier": "silver",
      "description": "Scoped lookups to a topic."
    },
    {
      "id": "polyglot",
      "name": "Polyglot",
      "tier": "silver",
      "description": "Looked up several dependencies."
    },
    {
      "id": "documented",
      "name": "Rule Setter",
      "tier": "silver",
      "description": "Told your agent to check docs first."
    },
    {
      "id": "shared",
      "name": "Shared",
      "tier": "bronze",
      "description": "Checked the server into the project."
    },
    {
      "id": "keeper",
      "name": "Keeper",
      "tier": "bronze",
      "description": "Keeps the API key out of git."
    },
    {
      "id": "informed",
      "name": "Informed",
      "tier": "gold",
      "description": "Docs-first is written into the rules."
    },
    {
      "id": "docs-devotee",
      "name": "Docs Devotee",
      "tier": "gold",
      "description": "Fetched docs 25 times.",
      "criteria": {
        "type": "mcp_tool",
        "server": "context7",
        "tool": "get-library-docs",
        "gte": 25
      }
    }
  ]
}
